
*** Running vivado
    with args -log adder4.vdi -applog -m64 -product Vivado -messageDb vivado.pb -mode batch -source adder4.tcl -notrace



****** Vivado v2021.1 (64-bit)
  **** SW Build 3247384 on Thu Jun 10 19:36:33 MDT 2021
  **** IP Build 3246043 on Fri Jun 11 00:30:35 MDT 2021
    ** Copyright 1986-2021 Xilinx, Inc. All Rights Reserved.

source adder4.tcl -notrace
Command: link_design -top adder4 -part xc7a35tcpg236-1
Design is defaulting to srcset: sources_1
Design is defaulting to constrset: constrs_1
INFO: [Device 21-403] Loading part xc7a35tcpg236-1
Netlist sorting complete. Time (s): cpu = 00:00:00 ; elapsed = 00:00:00 . Memory (MB): peak = 1282.969 ; gain = 0.000
INFO: [Project 1-479] Netlist was created with Vivado 2021.1
INFO: [Project 1-570] Preparing netlist for logic optimization
Parsing XDC File [E:/project/FPGA/ai1/02_1.adder4/02_1.adder4.srcs/constrs_1/new/BASYS3_4ADDR.xdc]
Finished Parsing XDC File [E:/project/FPGA/ai1/02_1.adder4/02_1.adder4.srcs/constrs_1/new/BASYS3_4ADDR.xdc]
INFO: [Opt 31-138] Pushed 0 inverter(s) to 0 load pin(s).
Netlist sorting complete. Time (s): cpu = 00:00:00 ; elapsed = 00:00:00.001 . Memory (MB): peak = 1282.969 ; gain = 0.000
INFO: [Project 1-111] Unisim Transformation Summary:
No Unisim elements were transformed.

5 Infos, 0 Warnings, 0 Critical Warnings and 0 Errors encountered.
link_design completed successfully
Command: opt_design
Attempting to get a license for feature 'Implementation' and/or device 'xc7a35t'
INFO: [Common 17-349] Got license for feature 'Implementation' and/or device 'xc7a35t'
Running DRC as a precondition to command opt_design

Starting DRC Task
INFO: [DRC 23-27] Running DRC with 2 threads
INFO: [Project 1-461] DRC finished with 0 Errors
INFO: [Project 1-462] Please refer to the DRC report (report_drc) for more information.

Time (s): cpu = 00:00:01 ; elapsed = 00:00:00.672 . Memory (MB): peak = 1282.969 ; gain = 0.000

Starting Cache Timing Information Task
INFO: [Timing 38-35] Done setting XDC timing constraints.
Ending Cache Timing Information Task | Checksum: 1b77c4a2b

Time (s): cpu = 00:00:06 ; elapsed = 00:00:06 . Memory (MB): peak = 1506.051 ; gain = 223.082

Starting Logic Optimization Task

Phase 1 Retarget
INFO: [Opt 31-138] Pushed 0 inverter(s) to 0 load pin(s).
INFO: [Opt 31-49] Retargeted 0 cell(s).
Phase 1 Retarget | Checksum: 1b77c4a2b

Time (s): cpu = 00:00:00 ; elapsed = 00:00:00.005 . Memory (MB): peak = 1715.746 ; gain = 0.000
INFO: [Opt 31-389] Phase Retarget created 0 cells and removed 0 cells

Phase 2 Constant propagation
INFO: [Opt 31-138] Pushed 0 inverter(s) to 0 load pin(s).
Phase 2 Constant propagation | Checksum: 1b77c4a2b

Time (s): cpu = 00:00:00 ; elapsed = 00:00:00.006 . Memory (MB): peak = 1715.746 ; gain = 0.000
INFO: [Opt 31-389] Phase Constant propagation created 0 cells and removed 0 cells

Phase 3 Sweep
Phase 3 Sweep | Checksum: 1b77c4a2b

Time (s): cpu = 00:00:00 ; elapsed = 00:00:00.007 . Memory (MB): peak = 1715.746 ; gain = 0.000
INFO: [Opt 31-389] Phase Sweep created 0 cells and removed 0 cells

Phase 4 BUFG optimization
Phase 4 BUFG optimization | Checksum: 1b77c4a2b

Time (s): cpu = 00:00:00 ; elapsed = 00:00:00.008 . Memory (MB): peak = 1715.746 ; gain = 0.000
INFO: [Opt 31-662] Phase BUFG optimization created 0 cells of which 0 are BUFGs and removed 0 cells.

Phase 5 Shift Register Optimization
INFO: [Opt 31-1064] SRL Remap converted 0 SRLs to 0 registers and converted 0 registers of register chains to 0 SRLs
Phase 5 Shift Register Optimization | Checksum: 1b77c4a2b

Time (s): cpu = 00:00:00 ; elapsed = 00:00:00.009 . Memory (MB): peak = 1715.746 ; gain = 0.000
INFO: [Opt 31-389] Phase Shift Register Optimization created 0 cells and removed 0 cells

Phase 6 Post Processing Netlist
Phase 6 Post Processing Netlist | Checksum: 1b77c4a2b

Time (s): cpu = 00:00:00 ; elapsed = 00:00:00.009 . Memory (MB): peak = 1715.746 ; gain = 0.000
INFO: [Opt 31-389] Phase Post Processing Netlist created 0 cells and removed 0 cells
Opt_design Change Summary
=========================


-------------------------------------------------------------------------------------------------------------------------
|  Phase                        |  #Cells created  |  #Cells Removed  |  #Constrained objects preventing optimizations  |
-------------------------------------------------------------------------------------------------------------------------
|  Retarget                     |               0  |               0  |                                              0  |
|  Constant propagation         |               0  |               0  |                                              0  |
|  Sweep                        |               0  |               0  |                                              0  |
|  BUFG optimization            |               0  |               0  |                                              0  |
|  Shift Register Optimization  |               0  |               0  |                                              0  |
|  Post Processing Netlist      |               0  |               0  |                                              0  |
-------------------------------------------------------------------------------------------------------------------------



Starting Connectivity Check Task

Time (s): cpu = 00:00:00 ; elapsed = 00:00:00 . Memory (MB): peak = 1715.746 ; gain = 0.000
Ending Logic Optimization Task | Checksum: 1b77c4a2b

Time (s): cpu = 00:00:00 ; elapsed = 00:00:00.011 . Memory (MB): peak = 1715.746 ; gain = 0.000

Starting Power Optimization Task
INFO: [Pwropt 34-132] Skipping clock gating for clocks with a period < 2.00 ns.
Ending Power Optimization Task | Checksum: 1b77c4a2b

Time (s): cpu = 00:00:00 ; elapsed = 00:00:00.006 . Memory (MB): peak = 1715.746 ; gain = 0.000

Starting Final Cleanup Task
Ending Final Cleanup Task | Checksum: 1b77c4a2b

Time (s): cpu = 00:00:00 ; elapsed = 00:00:00 . Memory (MB): peak = 1715.746 ; gain = 0.000

Starting Netlist Obfuscation Task
Netlist sorting complete. Time (s): cpu = 00:00:00 ; elapsed = 00:00:00 . Memory (MB): peak = 1715.746 ; gain = 0.000
Ending Netlist Obfuscation Task | Checksum: 1b77c4a2b

Time (s): cpu = 00:00:00 ; elapsed = 00:00:00 . Memory (MB): peak = 1715.746 ; gain = 0.000
INFO: [Common 17-83] Releasing license: Implementation
22 Infos, 0 Warnings, 0 Critical Warnings and 0 Errors encountered.
opt_design completed successfully
opt_design: Time (s): cpu = 00:00:09 ; elapsed = 00:00:09 . Memory (MB): peak = 1715.746 ; gain = 432.777
INFO: [Timing 38-480] Writing timing data to binary archive.
Writing placer database...
Writing XDEF routing.
Writing XDEF routing logical nets.
Writing XDEF routing special nets.
Write XDEF Complete: Time (s): cpu = 00:00:00 ; elapsed = 00:00:00.021 . Memory (MB): peak = 1715.746 ; gain = 0.000
INFO: [Common 17-1381] The checkpoint 'E:/project/FPGA/ai1/02_1.adder4/02_1.adder4.runs/impl_1/adder4_opt.dcp' has been generated.
INFO: [runtcl-4] Executing : report_drc -file adder4_drc_opted.rpt -pb adder4_drc_opted.pb -rpx adder4_drc_opted.rpx
Command: report_drc -file adder4_drc_opted.rpt -pb adder4_drc_opted.pb -rpx adder4_drc_opted.rpx
INFO: [IP_Flow 19-234] Refreshing IP repositories
INFO: [IP_Flow 19-1704] No user IP repositories specified
INFO: [IP_Flow 19-2313] Loaded Vivado IP repository 'E:/Xilinx/Vivado/2021.1/data/ip'.
INFO: [Timing 38-35] Done setting XDC timing constraints.
INFO: [DRC 23-27] Running DRC with 2 threads
INFO: [Vivado_Tcl 2-168] The results of DRC are in file E:/project/FPGA/ai1/02_1.adder4/02_1.adder4.runs/impl_1/adder4_drc_opted.rpt.
report_drc completed successfully
Command: place_design
Attempting to get a license for feature 'Implementation' and/or device 'xc7a35t'
INFO: [Common 17-349] Got license for feature 'Implementation' and/or device 'xc7a35t'
INFO: [DRC 23-27] Running DRC with 2 threads
INFO: [Vivado_Tcl 4-198] DRC finished with 0 Errors
INFO: [Vivado_Tcl 4-199] Please refer to the DRC report (report_drc) for more information.
Running DRC as a precondition to command place_design
INFO: [DRC 23-27] Running DRC with 2 threads
INFO: [Vivado_Tcl 4-198] DRC finished with 0 Errors
INFO: [Vivado_Tcl 4-199] Please refer to the DRC report (report_drc) for more information.

Starting Placer Task
INFO: [Place 30-611] Multithreading enabled for place_design using a maximum of 2 CPUs

Phase 1 Placer Initialization

Phase 1.1 Placer Initialization Netlist Sorting
Netlist sorting complete. Time (s): cpu = 00:00:00 ; elapsed = 00:00:00 . Memory (MB): peak = 1761.820 ; gain = 0.000
Phase 1.1 Placer Initialization Netlist Sorting | Checksum: 195cea3d9

Time (s): cpu = 00:00:00 ; elapsed = 00:00:00.003 . Memory (MB): peak = 1761.820 ; gain = 0.000
Netlist sorting complete. Time (s): cpu = 00:00:00 ; elapsed = 00:00:00 . Memory (MB): peak = 1761.820 ; gain = 0.000

Phase 1.2 IO Placement/ Clock Placement/ Build Placer Device
Phase 1.2 IO Placement/ Clock Placement/ Build Placer Device | Checksum: 195cea3d9

Time (s): cpu = 00:00:01 ; elapsed = 00:00:00.048 . Memory (MB): peak = 1761.820 ; gain = 0.000

Phase 1.3 Build Placer Netlist Model
Phase 1.3 Build Placer Netlist Model | Checksum: 19b5714d8

Time (s): cpu = 00:00:01 ; elapsed = 00:00:00.055 . Memory (MB): peak = 1761.820 ; gain = 0.000

Phase 1.4 Constrain Clocks/Macros
Phase 1.4 Constrain Clocks/Macros | Checksum: 19b5714d8

Time (s): cpu = 00:00:01 ; elapsed = 00:00:00.056 . Memory (MB): peak = 1761.820 ; gain = 0.000
Phase 1 Placer Initialization | Checksum: 19b5714d8

Time (s): cpu = 00:00:01 ; elapsed = 00:00:00.057 . Memory (MB): peak = 1761.820 ; gain = 0.000

Phase 2 Global Placement

Phase 2.1 Floorplanning
Phase 2.1 Floorplanning | Checksum: 19b5714d8

Time (s): cpu = 00:00:01 ; elapsed = 00:00:00.058 . Memory (MB): peak = 1761.820 ; gain = 0.000

Phase 2.2 Update Timing before SLR Path Opt
Phase 2.2 Update Timing before SLR Path Opt | Checksum: 19b5714d8

Time (s): cpu = 00:00:01 ; elapsed = 00:00:00.058 . Memory (MB): peak = 1761.820 ; gain = 0.000

Phase 2.3 Post-Processing in Floorplanning
Phase 2.3 Post-Processing in Floorplanning | Checksum: 19b5714d8

Time (s): cpu = 00:00:01 ; elapsed = 00:00:00.058 . Memory (MB): peak = 1761.820 ; gain = 0.000

Phase 2.4 Global Placement Core
WARNING: [Place 46-29] place_design is not in timing mode. Skip physical synthesis in placer
Phase 2.4 Global Placement Core | Checksum: 1b4158af7

Time (s): cpu = 00:00:01 ; elapsed = 00:00:00.400 . Memory (MB): peak = 1761.820 ; gain = 0.000
Phase 2 Global Placement | Checksum: 1b4158af7

Time (s): cpu = 00:00:01 ; elapsed = 00:00:00.402 . Memory (MB): peak = 1761.820 ; gain = 0.000

Phase 3 Detail Placement

Phase 3.1 Commit Multi Column Macros
Phase 3.1 Commit Multi Column Macros | Checksum: 1b4158af7

Time (s): cpu = 00:00:01 ; elapsed = 00:00:00.403 . Memory (MB): peak = 1761.820 ; gain = 0.000

Phase 3.2 Commit Most Macros & LUTRAMs
Phase 3.2 Commit Most Macros & LUTRAMs | Checksum: 255afb42b

Time (s): cpu = 00:00:01 ; elapsed = 00:00:00.405 . Memory (MB): peak = 1761.820 ; gain = 0.000

Phase 3.3 Area Swap Optimization
Phase 3.3 Area Swap Optimization | Checksum: 23b2e1228

Time (s): cpu = 00:00:01 ; elapsed = 00:00:00.411 . Memory (MB): peak = 1761.820 ; gain = 0.000

Phase 3.4 Pipeline Register Optimization
Phase 3.4 Pipeline Register Optimization | Checksum: 23b2e1228

Time (s): cpu = 00:00:01 ; elapsed = 00:00:00.411 . Memory (MB): peak = 1761.820 ; gain = 0.000

Phase 3.5 Small Shape Detail Placement
Phase 3.5 Small Shape Detail Placement | Checksum: 261729bbd

Time (s): cpu = 00:00:01 ; elapsed = 00:00:00.483 . Memory (MB): peak = 1761.820 ; gain = 0.000

Phase 3.6 Re-assign LUT pins
Phase 3.6 Re-assign LUT pins | Checksum: 261729bbd

Time (s): cpu = 00:00:01 ; elapsed = 00:00:00.484 . Memory (MB): peak = 1761.820 ; gain = 0.000

Phase 3.7 Pipeline Register Optimization
Phase 3.7 Pipeline Register Optimization | Checksum: 261729bbd

Time (s): cpu = 00:00:01 ; elapsed = 00:00:00.485 . Memory (MB): peak = 1761.820 ; gain = 0.000
Phase 3 Detail Placement | Checksum: 261729bbd

Time (s): cpu = 00:00:01 ; elapsed = 00:00:00.485 . Memory (MB): peak = 1761.820 ; gain = 0.000

Phase 4 Post Placement Optimization and Clean-Up

Phase 4.1 Post Commit Optimization
Phase 4.1 Post Commit Optimization | Checksum: 261729bbd

Time (s): cpu = 00:00:01 ; elapsed = 00:00:00.486 . Memory (MB): peak = 1761.820 ; gain = 0.000

Phase 4.2 Post Placement Cleanup
Phase 4.2 Post Placement Cleanup | Checksum: 261729bbd

Time (s): cpu = 00:00:01 ; elapsed = 00:00:00.488 . Memory (MB): peak = 1761.820 ; gain = 0.000

Phase 4.3 Placer Reporting

Phase 4.3.1 Print Estimated Congestion
INFO: [Place 30-612] Post-Placement Estimated Congestion 
 ____________________________________________________
|           | Global Congestion | Short Congestion  |
| Direction | Region Size       | Region Size       |
|___________|___________________|___________________|
|      North|                1x1|                1x1|
|___________|___________________|___________________|
|      South|                1x1|                1x1|
|___________|___________________|___________________|
|       East|                1x1|                1x1|
|___________|___________________|___________________|
|       West|                1x1|                1x1|
|___________|___________________|___________________|

Phase 4.3.1 Print Estimated Congestion | Checksum: 261729bbd

Time (s): cpu = 00:00:01 ; elapsed = 00:00:00.488 . Memory (MB): peak = 1761.820 ; gain = 0.000
Phase 4.3 Placer Reporting | Checksum: 261729bbd

Time (s): cpu = 00:00:01 ; elapsed = 00:00:00.489 . Memory (MB): peak = 1761.820 ; gain = 0.000

Phase 4.4 Final Placement Cleanup
Netlist sorting complete. Time (s): cpu = 00:00:00 ; elapsed = 00:00:00 . Memory (MB): peak = 1761.820 ; gain = 0.000

Time (s): cpu = 00:00:01 ; elapsed = 00:00:00.489 . Memory (MB): peak = 1761.820 ; gain = 0.000
Phase 4 Post Placement Optimization and Clean-Up | Checksum: 261729bbd

Time (s): cpu = 00:00:01 ; elapsed = 00:00:00.489 . Memory (MB): peak = 1761.820 ; gain = 0.000
Ending Placer Task | Checksum: 1bd24f77c

Time (s): cpu = 00:00:01 ; elapsed = 00:00:00.489 . Memory (MB): peak = 1761.820 ; gain = 0.000
INFO: [Common 17-83] Releasing license: Implementation
41 Infos, 1 Warnings, 0 Critical Warnings and 0 Errors encountered.
place_design completed successfully
INFO: [Timing 38-480] Writing timing data to binary archive.
Writing placer database...
Writing XDEF routing.
Writing XDEF routing logical nets.
Writing XDEF routing special nets.
Write XDEF Complete: Time (s): cpu = 00:00:00 ; elapsed = 00:00:00.031 . Memory (MB): peak = 1761.820 ; gain = 0.000
INFO: [Common 17-1381] The checkpoint 'E:/project/FPGA/ai1/02_1.adder4/02_1.adder4.runs/impl_1/adder4_placed.dcp' has been generated.
INFO: [runtcl-4] Executing : report_io -file adder4_io_placed.rpt
report_io: Time (s): cpu = 00:00:00 ; elapsed = 00:00:00.025 . Memory (MB): peak = 1761.820 ; gain = 0.000
INFO: [runtcl-4] Executing : report_utilization -file adder4_utilization_placed.rpt -pb adder4_utilization_placed.pb
INFO: [runtcl-4] Executing : report_control_sets -verbose -file adder4_control_sets_placed.rpt
report_control_sets: Time (s): cpu = 00:00:00 ; elapsed = 00:00:00.001 . Memory (MB): peak = 1761.820 ; gain = 0.000
Command: phys_opt_design
Attempting to get a license for feature 'Implementation' and/or device 'xc7a35t'
INFO: [Common 17-349] Got license for feature 'Implementation' and/or device 'xc7a35t'
INFO: [Vivado_Tcl 4-235] No timing constraint found. The netlist was not modified.
INFO: [Common 17-83] Releasing license: Implementation
49 Infos, 1 Warnings, 0 Critical Warnings and 0 Errors encountered.
phys_opt_design completed successfully
INFO: [Timing 38-480] Writing timing data to binary archive.
Writing placer database...
Writing XDEF routing.
Writing XDEF routing logical nets.
Writing XDEF routing special nets.
Write XDEF Complete: Time (s): cpu = 00:00:00 ; elapsed = 00:00:00.024 . Memory (MB): peak = 1761.820 ; gain = 0.000
INFO: [Common 17-1381] The checkpoint 'E:/project/FPGA/ai1/02_1.adder4/02_1.adder4.runs/impl_1/adder4_physopt.dcp' has been generated.
Command: route_design
Attempting to get a license for feature 'Implementation' and/or device 'xc7a35t'
INFO: [Common 17-349] Got license for feature 'Implementation' and/or device 'xc7a35t'
Running DRC as a precondition to command route_design
INFO: [DRC 23-27] Running DRC with 2 threads
INFO: [Vivado_Tcl 4-198] DRC finished with 0 Errors
INFO: [Vivado_Tcl 4-199] Please refer to the DRC report (report_drc) for more information.


Starting Routing Task
INFO: [Route 35-254] Multithreading enabled for route_design using a maximum of 2 CPUs
Checksum: PlaceDB: d11d6478 ConstDB: 0 ShapeSum: ec079304 RouteDB: 0

Phase 1 Build RT Design
Phase 1 Build RT Design | Checksum: 16e9c69e8

Time (s): cpu = 00:00:14 ; elapsed = 00:00:12 . Memory (MB): peak = 1849.598 ; gain = 85.684
Post Restoration Checksum: NetGraph: f1bb5dda NumContArr: 7ce10c0e Constraints: 0 Timing: 0

Phase 2 Router Initialization
INFO: [Route 35-64] No timing constraints were detected. The router will operate in resource-optimization mode.

Phase 2.1 Fix Topology Constraints
Phase 2.1 Fix Topology Constraints | Checksum: 16e9c69e8

Time (s): cpu = 00:00:14 ; elapsed = 00:00:12 . Memory (MB): peak = 1855.621 ; gain = 91.707

Phase 2.2 Pre Route Cleanup
Phase 2.2 Pre Route Cleanup | Checksum: 16e9c69e8

Time (s): cpu = 00:00:14 ; elapsed = 00:00:12 . Memory (MB): peak = 1855.621 ; gain = 91.707
 Number of Nodes with overlaps = 0
Phase 2 Router Initialization | Checksum: 1aba6cdfe

Time (s): cpu = 00:00:14 ; elapsed = 00:00:12 . Memory (MB): peak = 1859.406 ; gain = 95.492

Router Utilization Summary
  Global Vertical Routing Utilization    = 0 %
  Global Horizontal Routing Utilization  = 0 %
  Routable Net Status*
  *Does not include unroutable nets such as driverless and loadless.
  Run report_route_status for detailed report.
  Number of Failed Nets               = 15
    (Failed Nets is the sum of unrouted and partially routed nets)
  Number of Unrouted Nets             = 15
  Number of Partially Routed Nets     = 0
  Number of Node Overlaps             = 0


Phase 3 Initial Routing

Phase 3.1 Global Routing
Phase 3.1 Global Routing | Checksum: 1aba6cdfe

Time (s): cpu = 00:00:14 ; elapsed = 00:00:12 . Memory (MB): peak = 1860.676 ; gain = 96.762
Phase 3 Initial Routing | Checksum: e966982d

Time (s): cpu = 00:00:14 ; elapsed = 00:00:12 . Memory (MB): peak = 1860.676 ; gain = 96.762

Phase 4 Rip-up And Reroute

Phase 4.1 Global Iteration 0
 Number of Nodes with overlaps = 0
Phase 4.1 Global Iteration 0 | Checksum: 19c57e626

Time (s): cpu = 00:00:14 ; elapsed = 00:00:12 . Memory (MB): peak = 1860.676 ; gain = 96.762
Phase 4 Rip-up And Reroute | Checksum: 19c57e626

Time (s): cpu = 00:00:14 ; elapsed = 00:00:12 . Memory (MB): peak = 1860.676 ; gain = 96.762

Phase 5 Delay and Skew Optimization
Phase 5 Delay and Skew Optimization | Checksum: 19c57e626

Time (s): cpu = 00:00:14 ; elapsed = 00:00:12 . Memory (MB): peak = 1860.676 ; gain = 96.762

Phase 6 Post Hold Fix

Phase 6.1 Hold Fix Iter
Phase 6.1 Hold Fix Iter | Checksum: 19c57e626

Time (s): cpu = 00:00:14 ; elapsed = 00:00:12 . Memory (MB): peak = 1860.676 ; gain = 96.762
Phase 6 Post Hold Fix | Checksum: 19c57e626

Time (s): cpu = 00:00:14 ; elapsed = 00:00:12 . Memory (MB): peak = 1860.676 ; gain = 96.762

Phase 7 Route finalize

Router Utilization Summary
  Global Vertical Routing Utilization    = 0.0110819 %
  Global Horizontal Routing Utilization  = 0.00884956 %
  Routable Net Status*
  *Does not include unroutable nets such as driverless and loadless.
  Run report_route_status for detailed report.
  Number of Failed Nets               = 0
    (Failed Nets is the sum of unrouted and partially routed nets)
  Number of Unrouted Nets             = 0
  Number of Partially Routed Nets     = 0
  Number of Node Overlaps             = 0

Congestion Report
North Dir 1x1 Area, Max Cong = 16.2162%, No Congested Regions.
South Dir 1x1 Area, Max Cong = 16.2162%, No Congested Regions.
East Dir 1x1 Area, Max Cong = 7.35294%, No Congested Regions.
West Dir 1x1 Area, Max Cong = 5.88235%, No Congested Regions.

------------------------------
Reporting congestion hotspots
------------------------------
Direction: North
----------------
Congested clusters found at Level 0
Effective congestion level: 0 Aspect Ratio: 1 Sparse Ratio: 0
Direction: South
----------------
Congested clusters found at Level 0
Effective congestion level: 0 Aspect Ratio: 1 Sparse Ratio: 0
Direction: East
----------------
Congested clusters found at Level 0
Effective congestion level: 0 Aspect Ratio: 1 Sparse Ratio: 0
Direction: West
----------------
Congested clusters found at Level 0
Effective congestion level: 0 Aspect Ratio: 1 Sparse Ratio: 0

Phase 7 Route finalize | Checksum: 19c57e626

Time (s): cpu = 00:00:14 ; elapsed = 00:00:12 . Memory (MB): peak = 1860.676 ; gain = 96.762

Phase 8 Verifying routed nets

 Verification completed successfully
Phase 8 Verifying routed nets | Checksum: 19c57e626

Time (s): cpu = 00:00:14 ; elapsed = 00:00:12 . Memory (MB): peak = 1861.316 ; gain = 97.402

Phase 9 Depositing Routes
Phase 9 Depositing Routes | Checksum: 19778ed82

Time (s): cpu = 00:00:14 ; elapsed = 00:00:12 . Memory (MB): peak = 1861.316 ; gain = 97.402
INFO: [Route 35-16] Router Completed Successfully

Time (s): cpu = 00:00:14 ; elapsed = 00:00:12 . Memory (MB): peak = 1861.316 ; gain = 97.402

Routing Is Done.
INFO: [Common 17-83] Releasing license: Implementation
59 Infos, 1 Warnings, 0 Critical Warnings and 0 Errors encountered.
route_design completed successfully
route_design: Time (s): cpu = 00:00:14 ; elapsed = 00:00:13 . Memory (MB): peak = 1861.316 ; gain = 99.496
INFO: [Timing 38-480] Writing timing data to binary archive.
Writing placer database...
Writing XDEF routing.
Writing XDEF routing logical nets.
Writing XDEF routing special nets.
Write XDEF Complete: Time (s): cpu = 00:00:00 ; elapsed = 00:00:00.023 . Memory (MB): peak = 1871.207 ; gain = 9.891
INFO: [Common 17-1381] The checkpoint 'E:/project/FPGA/ai1/02_1.adder4/02_1.adder4.runs/impl_1/adder4_routed.dcp' has been generated.
INFO: [runtcl-4] Executing : report_drc -file adder4_drc_routed.rpt -pb adder4_drc_routed.pb -rpx adder4_drc_routed.rpx
Command: report_drc -file adder4_drc_routed.rpt -pb adder4_drc_routed.pb -rpx adder4_drc_routed.rpx
INFO: [IP_Flow 19-1839] IP Catalog is up to date.
INFO: [DRC 23-27] Running DRC with 2 threads
INFO: [Vivado_Tcl 2-168] The results of DRC are in file E:/project/FPGA/ai1/02_1.adder4/02_1.adder4.runs/impl_1/adder4_drc_routed.rpt.
report_drc completed successfully
INFO: [runtcl-4] Executing : report_methodology -file adder4_methodology_drc_routed.rpt -pb adder4_methodology_drc_routed.pb -rpx adder4_methodology_drc_routed.rpx
Command: report_methodology -file adder4_methodology_drc_routed.rpt -pb adder4_methodology_drc_routed.pb -rpx adder4_methodology_drc_routed.rpx
INFO: [Timing 38-35] Done setting XDC timing constraints.
INFO: [DRC 23-133] Running Methodology with 2 threads
INFO: [Vivado_Tcl 2-1520] The results of Report Methodology are in file E:/project/FPGA/ai1/02_1.adder4/02_1.adder4.runs/impl_1/adder4_methodology_drc_routed.rpt.
report_methodology completed successfully
INFO: [runtcl-4] Executing : report_power -file adder4_power_routed.rpt -pb adder4_power_summary_routed.pb -rpx adder4_power_routed.rpx
Command: report_power -file adder4_power_routed.rpt -pb adder4_power_summary_routed.pb -rpx adder4_power_routed.rpx
INFO: [Timing 38-35] Done setting XDC timing constraints.
WARNING: [Power 33-232] No user defined clocks were found in the design! Power estimation will be inaccurate until this is corrected.
Resolution: Please specify clocks using create_clock/create_generated_clock for sequential elements. For pure combinatorial circuits, please specify a virtual clock, otherwise the vectorless estimation might be inaccurate
Running Vector-less Activity Propagation...

Finished Running Vector-less Activity Propagation
71 Infos, 2 Warnings, 0 Critical Warnings and 0 Errors encountered.
report_power completed successfully
INFO: [runtcl-4] Executing : report_route_status -file adder4_route_status.rpt -pb adder4_route_status.pb
INFO: [runtcl-4] Executing : report_timing_summary -max_paths 10 -file adder4_timing_summary_routed.rpt -pb adder4_timing_summary_routed.pb -rpx adder4_timing_summary_routed.rpx -warn_on_violation 
INFO: [Timing 38-91] UpdateTimingParams: Speed grade: -1, Delay Type: min_max.
INFO: [Timing 38-191] Multithreading enabled for timing update using a maximum of 2 CPUs
WARNING: [Timing 38-313] There are no user specified timing constraints. Timing constraints are needed for proper timing analysis.
INFO: [runtcl-4] Executing : report_incremental_reuse -file adder4_incremental_reuse_routed.rpt
INFO: [Vivado_Tcl 4-1062] Incremental flow is disabled. No incremental reuse Info to report.
INFO: [runtcl-4] Executing : report_clock_utilization -file adder4_clock_utilization_routed.rpt
INFO: [runtcl-4] Executing : report_bus_skew -warn_on_violation -file adder4_bus_skew_routed.rpt -pb adder4_bus_skew_routed.pb -rpx adder4_bus_skew_routed.rpx
INFO: [Timing 38-91] UpdateTimingParams: Speed grade: -1, Delay Type: min_max.
INFO: [Timing 38-191] Multithreading enabled for timing update using a maximum of 2 CPUs
INFO: [Common 17-206] Exiting Vivado at Wed Feb 11 10:19:07 2026...

*** Running vivado
    with args -log adder4.vdi -applog -m64 -product Vivado -messageDb vivado.pb -mode batch -source adder4.tcl -notrace



****** Vivado v2021.1 (64-bit)
  **** SW Build 3247384 on Thu Jun 10 19:36:33 MDT 2021
  **** IP Build 3246043 on Fri Jun 11 00:30:35 MDT 2021
    ** Copyright 1986-2021 Xilinx, Inc. All Rights Reserved.

source adder4.tcl -notrace
Command: open_checkpoint adder4_routed.dcp

Time (s): cpu = 00:00:00 ; elapsed = 00:00:00.030 . Memory (MB): peak = 1281.613 ; gain = 0.000
INFO: [Device 21-403] Loading part xc7a35tcpg236-1
Netlist sorting complete. Time (s): cpu = 00:00:00 ; elapsed = 00:00:00 . Memory (MB): peak = 1281.613 ; gain = 0.000
INFO: [Project 1-479] Netlist was created with Vivado 2021.1
INFO: [Project 1-570] Preparing netlist for logic optimization
INFO: [Timing 38-478] Restoring timing data from binary archive.
INFO: [Timing 38-479] Binary timing data restore complete.
INFO: [Project 1-856] Restoring constraints from binary archive.
INFO: [Project 1-853] Binary constraint restore complete.
Reading XDEF placement.
Reading placer database...
Reading XDEF routing.
Read XDEF File: Time (s): cpu = 00:00:00 ; elapsed = 00:00:00.068 . Memory (MB): peak = 1504.285 ; gain = 16.496
Restored from archive | CPU: 0.000000 secs | Memory: 0.000000 MB |
Finished XDEF File Restore: Time (s): cpu = 00:00:00 ; elapsed = 00:00:00.069 . Memory (MB): peak = 1504.285 ; gain = 16.496
Netlist sorting complete. Time (s): cpu = 00:00:00 ; elapsed = 00:00:00 . Memory (MB): peak = 1504.285 ; gain = 0.000
INFO: [Project 1-111] Unisim Transformation Summary:
No Unisim elements were transformed.

INFO: [Project 1-604] Checkpoint was created with Vivado v2021.1 (64-bit) build 3247384
open_checkpoint: Time (s): cpu = 00:00:11 ; elapsed = 00:00:12 . Memory (MB): peak = 1504.285 ; gain = 222.672
Command: write_bitstream -force adder4.bit
Attempting to get a license for feature 'Implementation' and/or device 'xc7a35t'
INFO: [Common 17-349] Got license for feature 'Implementation' and/or device 'xc7a35t'
Running DRC as a precondition to command write_bitstream
INFO: [IP_Flow 19-234] Refreshing IP repositories
INFO: [IP_Flow 19-1704] No user IP repositories specified
INFO: [IP_Flow 19-2313] Loaded Vivado IP repository 'E:/Xilinx/Vivado/2021.1/data/ip'.
INFO: [DRC 23-27] Running DRC with 2 threads
INFO: [Vivado 12-3199] DRC finished with 0 Errors
INFO: [Vivado 12-3200] Please refer to the DRC report (report_drc) for more information.
INFO: [Designutils 20-2272] Running write_bitstream with 2 threads.
Loading data files...
Loading site data...
Loading route data...
Processing options...
Creating bitmap...
Creating bitstream...
Bitstream compression saved 15869472 bits.
Writing bitstream ./adder4.bit...
INFO: [Vivado 12-1842] Bitgen Completed Successfully.
INFO: [#UNDEF] WebTalk data collection is mandatory when using a WebPACK part without a full Vivado license. To see the specific WebTalk data collected for your design, open the usage_statistics_webtalk.html or usage_statistics_webtalk.xml file in the implementation directory.
INFO: [Common 17-83] Releasing license: Implementation
20 Infos, 0 Warnings, 0 Critical Warnings and 0 Errors encountered.
write_bitstream completed successfully
write_bitstream: Time (s): cpu = 00:00:08 ; elapsed = 00:00:09 . Memory (MB): peak = 1982.754 ; gain = 478.469
INFO: [Common 17-206] Exiting Vivado at Wed Feb 11 10:19:50 2026...
