
*** Running vivado
    with args -log top_btn.vdi -applog -m64 -product Vivado -messageDb vivado.pb -mode batch -source top_btn.tcl -notrace



****** Vivado v2021.1 (64-bit)
  **** SW Build 3247384 on Thu Jun 10 19:36:33 MDT 2021
  **** IP Build 3246043 on Fri Jun 11 00:30:35 MDT 2021
    ** Copyright 1986-2021 Xilinx, Inc. All Rights Reserved.

source top_btn.tcl -notrace
Command: link_design -top top_btn -part xc7a35tcpg236-1
Design is defaulting to srcset: sources_1
Design is defaulting to constrset: constrs_1
INFO: [Device 21-403] Loading part xc7a35tcpg236-1
Netlist sorting complete. Time (s): cpu = 00:00:00 ; elapsed = 00:00:00.001 . Memory (MB): peak = 1282.602 ; gain = 0.000
INFO: [Netlist 29-17] Analyzing 5 Unisim elements for replacement
INFO: [Netlist 29-28] Unisim Transformation completed in 0 CPU seconds
INFO: [Project 1-479] Netlist was created with Vivado 2021.1
INFO: [Project 1-570] Preparing netlist for logic optimization
Parsing XDC File [E:/project/FPGA/ai1/05.btn_debounce_2ff/05.btn_debounce_2ff.srcs/constrs_1/imports/new/BASYS3_MASTER.xdc]
Finished Parsing XDC File [E:/project/FPGA/ai1/05.btn_debounce_2ff/05.btn_debounce_2ff.srcs/constrs_1/imports/new/BASYS3_MASTER.xdc]
INFO: [Opt 31-138] Pushed 0 inverter(s) to 0 load pin(s).
Netlist sorting complete. Time (s): cpu = 00:00:00 ; elapsed = 00:00:00 . Memory (MB): peak = 1282.602 ; gain = 0.000
INFO: [Project 1-111] Unisim Transformation Summary:
No Unisim elements were transformed.

7 Infos, 0 Warnings, 0 Critical Warnings and 0 Errors encountered.
link_design completed successfully
Command: opt_design
Attempting to get a license for feature 'Implementation' and/or device 'xc7a35t'
INFO: [Common 17-349] Got license for feature 'Implementation' and/or device 'xc7a35t'
Running DRC as a precondition to command opt_design

Starting DRC Task
INFO: [DRC 23-27] Running DRC with 2 threads
INFO: [Project 1-461] DRC finished with 0 Errors
INFO: [Project 1-462] Please refer to the DRC report (report_drc) for more information.

Time (s): cpu = 00:00:02 ; elapsed = 00:00:00.690 . Memory (MB): peak = 1282.602 ; gain = 0.000

Starting Cache Timing Information Task
INFO: [Timing 38-35] Done setting XDC timing constraints.
Ending Cache Timing Information Task | Checksum: 153322655

Time (s): cpu = 00:00:06 ; elapsed = 00:00:06 . Memory (MB): peak = 1534.359 ; gain = 251.758

Starting Logic Optimization Task

Phase 1 Retarget
INFO: [Opt 31-138] Pushed 0 inverter(s) to 0 load pin(s).
INFO: [Opt 31-49] Retargeted 0 cell(s).
Phase 1 Retarget | Checksum: 153322655

Time (s): cpu = 00:00:00 ; elapsed = 00:00:00.008 . Memory (MB): peak = 1755.000 ; gain = 0.000
INFO: [Opt 31-389] Phase Retarget created 0 cells and removed 0 cells

Phase 2 Constant propagation
INFO: [Opt 31-138] Pushed 0 inverter(s) to 0 load pin(s).
Phase 2 Constant propagation | Checksum: 153322655

Time (s): cpu = 00:00:00 ; elapsed = 00:00:00.009 . Memory (MB): peak = 1755.000 ; gain = 0.000
INFO: [Opt 31-389] Phase Constant propagation created 0 cells and removed 0 cells

Phase 3 Sweep
Phase 3 Sweep | Checksum: 1655d5d83

Time (s): cpu = 00:00:00 ; elapsed = 00:00:00.010 . Memory (MB): peak = 1755.000 ; gain = 0.000
INFO: [Opt 31-389] Phase Sweep created 0 cells and removed 0 cells

Phase 4 BUFG optimization
Phase 4 BUFG optimization | Checksum: 1655d5d83

Time (s): cpu = 00:00:00 ; elapsed = 00:00:00.012 . Memory (MB): peak = 1755.000 ; gain = 0.000
INFO: [Opt 31-662] Phase BUFG optimization created 0 cells of which 0 are BUFGs and removed 0 cells.

Phase 5 Shift Register Optimization
INFO: [Opt 31-1064] SRL Remap converted 0 SRLs to 0 registers and converted 0 registers of register chains to 0 SRLs
Phase 5 Shift Register Optimization | Checksum: 1655d5d83

Time (s): cpu = 00:00:00 ; elapsed = 00:00:00.013 . Memory (MB): peak = 1755.000 ; gain = 0.000
INFO: [Opt 31-389] Phase Shift Register Optimization created 0 cells and removed 0 cells

Phase 6 Post Processing Netlist
Phase 6 Post Processing Netlist | Checksum: 1655d5d83

Time (s): cpu = 00:00:00 ; elapsed = 00:00:00.013 . Memory (MB): peak = 1755.000 ; gain = 0.000
INFO: [Opt 31-389] Phase Post Processing Netlist created 0 cells and removed 0 cells
Opt_design Change Summary
=========================


-------------------------------------------------------------------------------------------------------------------------
|  Phase                        |  #Cells created  |  #Cells Removed  |  #Constrained objects preventing optimizations  |
-------------------------------------------------------------------------------------------------------------------------
|  Retarget                     |               0  |               0  |                                              0  |
|  Constant propagation         |               0  |               0  |                                              0  |
|  Sweep                        |               0  |               0  |                                              0  |
|  BUFG optimization            |               0  |               0  |                                              0  |
|  Shift Register Optimization  |               0  |               0  |                                              0  |
|  Post Processing Netlist      |               0  |               0  |                                              0  |
-------------------------------------------------------------------------------------------------------------------------



Starting Connectivity Check Task

Time (s): cpu = 00:00:00 ; elapsed = 00:00:00 . Memory (MB): peak = 1755.000 ; gain = 0.000
Ending Logic Optimization Task | Checksum: 177cabff9

Time (s): cpu = 00:00:00 ; elapsed = 00:00:00.016 . Memory (MB): peak = 1755.000 ; gain = 0.000

Starting Power Optimization Task
INFO: [Pwropt 34-132] Skipping clock gating for clocks with a period < 2.00 ns.
Ending Power Optimization Task | Checksum: 177cabff9

Time (s): cpu = 00:00:00 ; elapsed = 00:00:00.006 . Memory (MB): peak = 1755.000 ; gain = 0.000

Starting Final Cleanup Task
Ending Final Cleanup Task | Checksum: 177cabff9

Time (s): cpu = 00:00:00 ; elapsed = 00:00:00 . Memory (MB): peak = 1755.000 ; gain = 0.000

Starting Netlist Obfuscation Task
Netlist sorting complete. Time (s): cpu = 00:00:00 ; elapsed = 00:00:00 . Memory (MB): peak = 1755.000 ; gain = 0.000
Ending Netlist Obfuscation Task | Checksum: 177cabff9

Time (s): cpu = 00:00:00 ; elapsed = 00:00:00 . Memory (MB): peak = 1755.000 ; gain = 0.000
INFO: [Common 17-83] Releasing license: Implementation
24 Infos, 0 Warnings, 0 Critical Warnings and 0 Errors encountered.
opt_design completed successfully
opt_design: Time (s): cpu = 00:00:09 ; elapsed = 00:00:09 . Memory (MB): peak = 1755.000 ; gain = 472.398
INFO: [Timing 38-480] Writing timing data to binary archive.
Writing placer database...
Writing XDEF routing.
Writing XDEF routing logical nets.
Writing XDEF routing special nets.
Write XDEF Complete: Time (s): cpu = 00:00:00 ; elapsed = 00:00:00.022 . Memory (MB): peak = 1755.000 ; gain = 0.000
INFO: [Common 17-1381] The checkpoint 'E:/project/FPGA/ai1/05.btn_debounce_2ff/05.btn_debounce_2ff.runs/impl_1/top_btn_opt.dcp' has been generated.
INFO: [runtcl-4] Executing : report_drc -file top_btn_drc_opted.rpt -pb top_btn_drc_opted.pb -rpx top_btn_drc_opted.rpx
Command: report_drc -file top_btn_drc_opted.rpt -pb top_btn_drc_opted.pb -rpx top_btn_drc_opted.rpx
INFO: [IP_Flow 19-234] Refreshing IP repositories
INFO: [IP_Flow 19-1704] No user IP repositories specified
INFO: [IP_Flow 19-2313] Loaded Vivado IP repository 'E:/Xilinx/Vivado/2021.1/data/ip'.
INFO: [Timing 38-35] Done setting XDC timing constraints.
INFO: [DRC 23-27] Running DRC with 2 threads
INFO: [Vivado_Tcl 2-168] The results of DRC are in file E:/project/FPGA/ai1/05.btn_debounce_2ff/05.btn_debounce_2ff.runs/impl_1/top_btn_drc_opted.rpt.
report_drc completed successfully
Command: place_design
Attempting to get a license for feature 'Implementation' and/or device 'xc7a35t'
INFO: [Common 17-349] Got license for feature 'Implementation' and/or device 'xc7a35t'
INFO: [DRC 23-27] Running DRC with 2 threads
INFO: [Vivado_Tcl 4-198] DRC finished with 0 Errors
INFO: [Vivado_Tcl 4-199] Please refer to the DRC report (report_drc) for more information.
Running DRC as a precondition to command place_design
INFO: [DRC 23-27] Running DRC with 2 threads
INFO: [Vivado_Tcl 4-198] DRC finished with 0 Errors
INFO: [Vivado_Tcl 4-199] Please refer to the DRC report (report_drc) for more information.

Starting Placer Task
INFO: [Place 30-611] Multithreading enabled for place_design using a maximum of 2 CPUs

Phase 1 Placer Initialization

Phase 1.1 Placer Initialization Netlist Sorting
Netlist sorting complete. Time (s): cpu = 00:00:00 ; elapsed = 00:00:00 . Memory (MB): peak = 1798.090 ; gain = 0.000
Phase 1.1 Placer Initialization Netlist Sorting | Checksum: ff6704dd

Time (s): cpu = 00:00:00 ; elapsed = 00:00:00.004 . Memory (MB): peak = 1798.090 ; gain = 0.000
Netlist sorting complete. Time (s): cpu = 00:00:00 ; elapsed = 00:00:00 . Memory (MB): peak = 1798.090 ; gain = 0.000

Phase 1.2 IO Placement/ Clock Placement/ Build Placer Device
WARNING: [Place 30-568] A LUT 'u_button_debounce/u1_D_FF/r_led_toggle_i_2' is driving clock pin of 1 registers. This could lead to large hold time violations. First few involved registers are:
	u_led_toggle/r_led_toggle_reg {FDRE}
Phase 1.2 IO Placement/ Clock Placement/ Build Placer Device | Checksum: 141a05c86

Time (s): cpu = 00:00:00 ; elapsed = 00:00:00.146 . Memory (MB): peak = 1798.090 ; gain = 0.000

Phase 1.3 Build Placer Netlist Model
Phase 1.3 Build Placer Netlist Model | Checksum: 1ec6945cc

Time (s): cpu = 00:00:00 ; elapsed = 00:00:00.204 . Memory (MB): peak = 1798.090 ; gain = 0.000

Phase 1.4 Constrain Clocks/Macros
Phase 1.4 Constrain Clocks/Macros | Checksum: 1ec6945cc

Time (s): cpu = 00:00:00 ; elapsed = 00:00:00.206 . Memory (MB): peak = 1798.090 ; gain = 0.000
Phase 1 Placer Initialization | Checksum: 1ec6945cc

Time (s): cpu = 00:00:00 ; elapsed = 00:00:00.207 . Memory (MB): peak = 1798.090 ; gain = 0.000

Phase 2 Global Placement

Phase 2.1 Floorplanning
Phase 2.1 Floorplanning | Checksum: 16686248c

Time (s): cpu = 00:00:00 ; elapsed = 00:00:00.278 . Memory (MB): peak = 1798.090 ; gain = 0.000

Phase 2.2 Update Timing before SLR Path Opt
Phase 2.2 Update Timing before SLR Path Opt | Checksum: 1460a335a

Time (s): cpu = 00:00:00 ; elapsed = 00:00:00.316 . Memory (MB): peak = 1798.090 ; gain = 0.000

Phase 2.3 Post-Processing in Floorplanning
Phase 2.3 Post-Processing in Floorplanning | Checksum: 1460a335a

Time (s): cpu = 00:00:00 ; elapsed = 00:00:00.317 . Memory (MB): peak = 1798.090 ; gain = 0.000

Phase 2.4 Global Placement Core

Phase 2.4.1 Physical Synthesis In Placer
INFO: [Physopt 32-1044] Break lutnm for timing: one critical 0, two critical 0, total 0, new lutff created 0
INFO: [Physopt 32-1138] End 1 Pass. Optimized 0 net or LUT. Breaked 0 LUT, combined 0 existing LUT and moved 0 existing LUT
INFO: [Physopt 32-65] No nets found for high-fanout optimization.
INFO: [Physopt 32-232] Optimized 0 net. Created 0 new instance.
INFO: [Physopt 32-775] End 1 Pass. Optimized 0 net or cell. Created 0 new cell, deleted 0 existing cell and moved 0 existing cell
INFO: [Physopt 32-670] No setup violation found.  DSP Register Optimization was not performed.
INFO: [Physopt 32-670] No setup violation found.  Shift Register to Pipeline Optimization was not performed.
INFO: [Physopt 32-670] No setup violation found.  Shift Register Optimization was not performed.
INFO: [Physopt 32-670] No setup violation found.  BRAM Register Optimization was not performed.
INFO: [Physopt 32-670] No setup violation found.  URAM Register Optimization was not performed.
INFO: [Physopt 32-949] No candidate nets found for dynamic/static region interface net replication
INFO: [Physopt 32-775] End 1 Pass. Optimized 0 net or cell. Created 0 new cell, deleted 0 existing cell and moved 0 existing cell
Netlist sorting complete. Time (s): cpu = 00:00:00 ; elapsed = 00:00:00 . Memory (MB): peak = 1798.090 ; gain = 0.000

Summary of Physical Synthesis Optimizations
============================================


-----------------------------------------------------------------------------------------------------------------------------------------------------------
|  Optimization                                     |  Added Cells  |  Removed Cells  |  Optimized Cells/Nets  |  Dont Touch  |  Iterations  |  Elapsed   |
-----------------------------------------------------------------------------------------------------------------------------------------------------------
|  LUT Combining                                    |            0  |              0  |                     0  |           0  |           1  |  00:00:00  |
|  Retime                                           |            0  |              0  |                     0  |           0  |           1  |  00:00:00  |
|  Very High Fanout                                 |            0  |              0  |                     0  |           0  |           1  |  00:00:00  |
|  DSP Register                                     |            0  |              0  |                     0  |           0  |           0  |  00:00:00  |
|  Shift Register to Pipeline                       |            0  |              0  |                     0  |           0  |           0  |  00:00:00  |
|  Shift Register                                   |            0  |              0  |                     0  |           0  |           0  |  00:00:00  |
|  BRAM Register                                    |            0  |              0  |                     0  |           0  |           0  |  00:00:00  |
|  URAM Register                                    |            0  |              0  |                     0  |           0  |           0  |  00:00:00  |
|  Dynamic/Static Region Interface Net Replication  |            0  |              0  |                     0  |           0  |           1  |  00:00:00  |
|  Total                                            |            0  |              0  |                     0  |           0  |           4  |  00:00:00  |
-----------------------------------------------------------------------------------------------------------------------------------------------------------


Phase 2.4.1 Physical Synthesis In Placer | Checksum: 176b5884d

Time (s): cpu = 00:00:01 ; elapsed = 00:00:00.791 . Memory (MB): peak = 1798.090 ; gain = 0.000
Phase 2.4 Global Placement Core | Checksum: 17723bc46

Time (s): cpu = 00:00:01 ; elapsed = 00:00:00.808 . Memory (MB): peak = 1798.090 ; gain = 0.000
Phase 2 Global Placement | Checksum: 17723bc46

Time (s): cpu = 00:00:01 ; elapsed = 00:00:00.809 . Memory (MB): peak = 1798.090 ; gain = 0.000

Phase 3 Detail Placement

Phase 3.1 Commit Multi Column Macros
Phase 3.1 Commit Multi Column Macros | Checksum: 18b7f6864

Time (s): cpu = 00:00:01 ; elapsed = 00:00:00.846 . Memory (MB): peak = 1798.090 ; gain = 0.000

Phase 3.2 Commit Most Macros & LUTRAMs
Phase 3.2 Commit Most Macros & LUTRAMs | Checksum: 1d8f40171

Time (s): cpu = 00:00:01 ; elapsed = 00:00:00.911 . Memory (MB): peak = 1798.090 ; gain = 0.000

Phase 3.3 Area Swap Optimization
Phase 3.3 Area Swap Optimization | Checksum: 177137770

Time (s): cpu = 00:00:01 ; elapsed = 00:00:00.914 . Memory (MB): peak = 1798.090 ; gain = 0.000

Phase 3.4 Pipeline Register Optimization
Phase 3.4 Pipeline Register Optimization | Checksum: 181a42533

Time (s): cpu = 00:00:01 ; elapsed = 00:00:00.914 . Memory (MB): peak = 1798.090 ; gain = 0.000

Phase 3.5 Small Shape Detail Placement
Phase 3.5 Small Shape Detail Placement | Checksum: 1640ec6b7

Time (s): cpu = 00:00:01 ; elapsed = 00:00:00.994 . Memory (MB): peak = 1798.090 ; gain = 0.000

Phase 3.6 Re-assign LUT pins
Phase 3.6 Re-assign LUT pins | Checksum: 1ba22f3b6

Time (s): cpu = 00:00:01 ; elapsed = 00:00:00.997 . Memory (MB): peak = 1798.090 ; gain = 0.000

Phase 3.7 Pipeline Register Optimization
Phase 3.7 Pipeline Register Optimization | Checksum: 1b3bbc59b

Time (s): cpu = 00:00:01 ; elapsed = 00:00:00.998 . Memory (MB): peak = 1798.090 ; gain = 0.000
Phase 3 Detail Placement | Checksum: 1b3bbc59b

Time (s): cpu = 00:00:01 ; elapsed = 00:00:00.998 . Memory (MB): peak = 1798.090 ; gain = 0.000

Phase 4 Post Placement Optimization and Clean-Up

Phase 4.1 Post Commit Optimization
INFO: [Timing 38-35] Done setting XDC timing constraints.

Phase 4.1.1 Post Placement Optimization
Post Placement Optimization Initialization | Checksum: 21f540437

Phase 4.1.1.1 BUFG Insertion

Starting Physical Synthesis Task

Phase 1 Physical Synthesis Initialization
INFO: [Physopt 32-721] Multithreading enabled for phys_opt_design using a maximum of 2 CPUs
INFO: [Physopt 32-619] Estimated Timing Summary | WNS=6.888 | TNS=0.000 |
Phase 1 Physical Synthesis Initialization | Checksum: 1c5765ea4

Time (s): cpu = 00:00:00 ; elapsed = 00:00:00.009 . Memory (MB): peak = 1798.090 ; gain = 0.000
INFO: [Place 46-56] BUFG insertion identified 0 candidate nets. Inserted BUFG: 0, Replicated BUFG Driver: 0, Skipped due to Placement/Routing Conflicts: 0, Skipped due to Timing Degradation: 0, Skipped due to Illegal Netlist: 0.
Ending Physical Synthesis Task | Checksum: 228e371f6

Time (s): cpu = 00:00:00 ; elapsed = 00:00:00.010 . Memory (MB): peak = 1798.090 ; gain = 0.000
Phase 4.1.1.1 BUFG Insertion | Checksum: 21f540437

Time (s): cpu = 00:00:01 ; elapsed = 00:00:01 . Memory (MB): peak = 1798.090 ; gain = 0.000

Phase 4.1.1.2 Post Placement Timing Optimization
INFO: [Place 30-746] Post Placement Timing Summary WNS=6.888. For the most accurate timing information please run report_timing.
Phase 4.1.1.2 Post Placement Timing Optimization | Checksum: 1df8ee934

Time (s): cpu = 00:00:01 ; elapsed = 00:00:01 . Memory (MB): peak = 1798.090 ; gain = 0.000

Time (s): cpu = 00:00:01 ; elapsed = 00:00:01 . Memory (MB): peak = 1798.090 ; gain = 0.000
Phase 4.1 Post Commit Optimization | Checksum: 1df8ee934

Time (s): cpu = 00:00:01 ; elapsed = 00:00:01 . Memory (MB): peak = 1798.090 ; gain = 0.000

Phase 4.2 Post Placement Cleanup
Phase 4.2 Post Placement Cleanup | Checksum: 1df8ee934

Time (s): cpu = 00:00:01 ; elapsed = 00:00:01 . Memory (MB): peak = 1798.090 ; gain = 0.000

Phase 4.3 Placer Reporting

Phase 4.3.1 Print Estimated Congestion
INFO: [Place 30-612] Post-Placement Estimated Congestion 
 ____________________________________________________
|           | Global Congestion | Short Congestion  |
| Direction | Region Size       | Region Size       |
|___________|___________________|___________________|
|      North|                1x1|                1x1|
|___________|___________________|___________________|
|      South|                1x1|                1x1|
|___________|___________________|___________________|
|       East|                1x1|                1x1|
|___________|___________________|___________________|
|       West|                1x1|                1x1|
|___________|___________________|___________________|

Phase 4.3.1 Print Estimated Congestion | Checksum: 1df8ee934

Time (s): cpu = 00:00:01 ; elapsed = 00:00:01 . Memory (MB): peak = 1798.090 ; gain = 0.000
Phase 4.3 Placer Reporting | Checksum: 1df8ee934

Time (s): cpu = 00:00:01 ; elapsed = 00:00:01 . Memory (MB): peak = 1798.090 ; gain = 0.000

Phase 4.4 Final Placement Cleanup
Netlist sorting complete. Time (s): cpu = 00:00:00 ; elapsed = 00:00:00 . Memory (MB): peak = 1798.090 ; gain = 0.000

Time (s): cpu = 00:00:01 ; elapsed = 00:00:01 . Memory (MB): peak = 1798.090 ; gain = 0.000
Phase 4 Post Placement Optimization and Clean-Up | Checksum: 16b2f7606

Time (s): cpu = 00:00:01 ; elapsed = 00:00:01 . Memory (MB): peak = 1798.090 ; gain = 0.000
Ending Placer Task | Checksum: 13c2043ac

Time (s): cpu = 00:00:01 ; elapsed = 00:00:01 . Memory (MB): peak = 1798.090 ; gain = 0.000
INFO: [Common 17-83] Releasing license: Implementation
60 Infos, 1 Warnings, 0 Critical Warnings and 0 Errors encountered.
place_design completed successfully
INFO: [Timing 38-480] Writing timing data to binary archive.
Writing placer database...
Writing XDEF routing.
Writing XDEF routing logical nets.
Writing XDEF routing special nets.
Write XDEF Complete: Time (s): cpu = 00:00:00 ; elapsed = 00:00:00.026 . Memory (MB): peak = 1798.090 ; gain = 0.000
INFO: [Common 17-1381] The checkpoint 'E:/project/FPGA/ai1/05.btn_debounce_2ff/05.btn_debounce_2ff.runs/impl_1/top_btn_placed.dcp' has been generated.
INFO: [runtcl-4] Executing : report_io -file top_btn_io_placed.rpt
report_io: Time (s): cpu = 00:00:00 ; elapsed = 00:00:00.018 . Memory (MB): peak = 1798.090 ; gain = 0.000
INFO: [runtcl-4] Executing : report_utilization -file top_btn_utilization_placed.rpt -pb top_btn_utilization_placed.pb
INFO: [runtcl-4] Executing : report_control_sets -verbose -file top_btn_control_sets_placed.rpt
report_control_sets: Time (s): cpu = 00:00:00 ; elapsed = 00:00:00.001 . Memory (MB): peak = 1798.090 ; gain = 0.000
Command: phys_opt_design
Attempting to get a license for feature 'Implementation' and/or device 'xc7a35t'
INFO: [Common 17-349] Got license for feature 'Implementation' and/or device 'xc7a35t'
INFO: [Vivado_Tcl 4-383] Design worst setup slack (WNS) is greater than or equal to 0.000 ns. Skipping all physical synthesis optimizations.
INFO: [Vivado_Tcl 4-232] No setup violation found. The netlist was not modified.
INFO: [Common 17-83] Releasing license: Implementation
69 Infos, 1 Warnings, 0 Critical Warnings and 0 Errors encountered.
phys_opt_design completed successfully
INFO: [Timing 38-480] Writing timing data to binary archive.
Writing placer database...
Writing XDEF routing.
Writing XDEF routing logical nets.
Writing XDEF routing special nets.
Write XDEF Complete: Time (s): cpu = 00:00:00 ; elapsed = 00:00:00.026 . Memory (MB): peak = 1798.090 ; gain = 0.000
INFO: [Common 17-1381] The checkpoint 'E:/project/FPGA/ai1/05.btn_debounce_2ff/05.btn_debounce_2ff.runs/impl_1/top_btn_physopt.dcp' has been generated.
Command: route_design
Attempting to get a license for feature 'Implementation' and/or device 'xc7a35t'
INFO: [Common 17-349] Got license for feature 'Implementation' and/or device 'xc7a35t'
Running DRC as a precondition to command route_design
INFO: [DRC 23-27] Running DRC with 2 threads
INFO: [Vivado_Tcl 4-198] DRC finished with 0 Errors
INFO: [Vivado_Tcl 4-199] Please refer to the DRC report (report_drc) for more information.


Starting Routing Task
INFO: [Route 35-254] Multithreading enabled for route_design using a maximum of 2 CPUs
Checksum: PlaceDB: d24160af ConstDB: 0 ShapeSum: 69dee2fd RouteDB: 0

Phase 1 Build RT Design
Phase 1 Build RT Design | Checksum: 11dd76638

Time (s): cpu = 00:00:13 ; elapsed = 00:00:12 . Memory (MB): peak = 1880.477 ; gain = 74.285
Post Restoration Checksum: NetGraph: 6668ff2f NumContArr: b76e6709 Constraints: 0 Timing: 0

Phase 2 Router Initialization

Phase 2.1 Create Timer
Phase 2.1 Create Timer | Checksum: 11dd76638

Time (s): cpu = 00:00:13 ; elapsed = 00:00:12 . Memory (MB): peak = 1880.477 ; gain = 74.285

Phase 2.2 Fix Topology Constraints
Phase 2.2 Fix Topology Constraints | Checksum: 11dd76638

Time (s): cpu = 00:00:13 ; elapsed = 00:00:12 . Memory (MB): peak = 1886.500 ; gain = 80.309

Phase 2.3 Pre Route Cleanup
Phase 2.3 Pre Route Cleanup | Checksum: 11dd76638

Time (s): cpu = 00:00:13 ; elapsed = 00:00:12 . Memory (MB): peak = 1886.500 ; gain = 80.309
 Number of Nodes with overlaps = 0

Phase 2.4 Update Timing
Phase 2.4 Update Timing | Checksum: 1fd894123

Time (s): cpu = 00:00:14 ; elapsed = 00:00:13 . Memory (MB): peak = 1891.980 ; gain = 85.789
INFO: [Route 35-416] Intermediate Timing Summary | WNS=6.805  | TNS=0.000  | WHS=-0.067 | THS=-0.067 |

Phase 2 Router Initialization | Checksum: 14b5ed4ec

Time (s): cpu = 00:00:14 ; elapsed = 00:00:13 . Memory (MB): peak = 1891.980 ; gain = 85.789

Router Utilization Summary
  Global Vertical Routing Utilization    = 0.00645779 %
  Global Horizontal Routing Utilization  = 0.000780843 %
  Routable Net Status*
  *Does not include unroutable nets such as driverless and loadless.
  Run report_route_status for detailed report.
  Number of Failed Nets               = 56
    (Failed Nets is the sum of unrouted and partially routed nets)
  Number of Unrouted Nets             = 54
  Number of Partially Routed Nets     = 2
  Number of Node Overlaps             = 1


Phase 3 Initial Routing

Phase 3.1 Global Routing
Phase 3.1 Global Routing | Checksum: 14b5ed4ec

Time (s): cpu = 00:00:14 ; elapsed = 00:00:13 . Memory (MB): peak = 1893.566 ; gain = 87.375
Phase 3 Initial Routing | Checksum: 135029941

Time (s): cpu = 00:00:14 ; elapsed = 00:00:13 . Memory (MB): peak = 1893.566 ; gain = 87.375

Phase 4 Rip-up And Reroute

Phase 4.1 Global Iteration 0
 Number of Nodes with overlaps = 4
 Number of Nodes with overlaps = 0
INFO: [Route 35-416] Intermediate Timing Summary | WNS=6.220  | TNS=0.000  | WHS=N/A    | THS=N/A    |

Phase 4.1 Global Iteration 0 | Checksum: 19befd66d

Time (s): cpu = 00:00:14 ; elapsed = 00:00:13 . Memory (MB): peak = 1893.566 ; gain = 87.375
Phase 4 Rip-up And Reroute | Checksum: 19befd66d

Time (s): cpu = 00:00:14 ; elapsed = 00:00:13 . Memory (MB): peak = 1893.566 ; gain = 87.375

Phase 5 Delay and Skew Optimization

Phase 5.1 Delay CleanUp
Phase 5.1 Delay CleanUp | Checksum: 19befd66d

Time (s): cpu = 00:00:14 ; elapsed = 00:00:13 . Memory (MB): peak = 1893.566 ; gain = 87.375

Phase 5.2 Clock Skew Optimization
Phase 5.2 Clock Skew Optimization | Checksum: 19befd66d

Time (s): cpu = 00:00:14 ; elapsed = 00:00:13 . Memory (MB): peak = 1893.566 ; gain = 87.375
Phase 5 Delay and Skew Optimization | Checksum: 19befd66d

Time (s): cpu = 00:00:14 ; elapsed = 00:00:13 . Memory (MB): peak = 1893.566 ; gain = 87.375

Phase 6 Post Hold Fix

Phase 6.1 Hold Fix Iter

Phase 6.1.1 Update Timing
Phase 6.1.1 Update Timing | Checksum: 1c56b3830

Time (s): cpu = 00:00:14 ; elapsed = 00:00:13 . Memory (MB): peak = 1893.566 ; gain = 87.375
INFO: [Route 35-416] Intermediate Timing Summary | WNS=6.313  | TNS=0.000  | WHS=0.232  | THS=0.000  |

Phase 6.1 Hold Fix Iter | Checksum: 1c56b3830

Time (s): cpu = 00:00:14 ; elapsed = 00:00:13 . Memory (MB): peak = 1893.566 ; gain = 87.375
Phase 6 Post Hold Fix | Checksum: 1c56b3830

Time (s): cpu = 00:00:14 ; elapsed = 00:00:13 . Memory (MB): peak = 1893.566 ; gain = 87.375

Phase 7 Route finalize

Router Utilization Summary
  Global Vertical Routing Utilization    = 0.0158654 %
  Global Horizontal Routing Utilization  = 0.0123634 %
  Routable Net Status*
  *Does not include unroutable nets such as driverless and loadless.
  Run report_route_status for detailed report.
  Number of Failed Nets               = 0
    (Failed Nets is the sum of unrouted and partially routed nets)
  Number of Unrouted Nets             = 0
  Number of Partially Routed Nets     = 0
  Number of Node Overlaps             = 0

Phase 7 Route finalize | Checksum: 18e6d5c17

Time (s): cpu = 00:00:14 ; elapsed = 00:00:13 . Memory (MB): peak = 1893.566 ; gain = 87.375

Phase 8 Verifying routed nets

 Verification completed successfully
Phase 8 Verifying routed nets | Checksum: 18e6d5c17

Time (s): cpu = 00:00:14 ; elapsed = 00:00:13 . Memory (MB): peak = 1894.219 ; gain = 88.027

Phase 9 Depositing Routes
Phase 9 Depositing Routes | Checksum: 1e52cf8b6

Time (s): cpu = 00:00:14 ; elapsed = 00:00:13 . Memory (MB): peak = 1894.219 ; gain = 88.027

Phase 10 Post Router Timing
INFO: [Route 35-57] Estimated Timing Summary | WNS=6.313  | TNS=0.000  | WHS=0.232  | THS=0.000  |

INFO: [Route 35-327] The final timing numbers are based on the router estimated timing analysis. For a complete and accurate timing signoff, please run report_timing_summary.
Phase 10 Post Router Timing | Checksum: 1e52cf8b6

Time (s): cpu = 00:00:14 ; elapsed = 00:00:13 . Memory (MB): peak = 1894.219 ; gain = 88.027
INFO: [Route 35-16] Router Completed Successfully

Time (s): cpu = 00:00:14 ; elapsed = 00:00:13 . Memory (MB): peak = 1894.219 ; gain = 88.027

Routing Is Done.
INFO: [Common 17-83] Releasing license: Implementation
83 Infos, 1 Warnings, 0 Critical Warnings and 0 Errors encountered.
route_design completed successfully
route_design: Time (s): cpu = 00:00:15 ; elapsed = 00:00:13 . Memory (MB): peak = 1894.219 ; gain = 96.129
INFO: [Timing 38-480] Writing timing data to binary archive.
Writing placer database...
Writing XDEF routing.
Writing XDEF routing logical nets.
Writing XDEF routing special nets.
Write XDEF Complete: Time (s): cpu = 00:00:00 ; elapsed = 00:00:00.028 . Memory (MB): peak = 1904.094 ; gain = 9.875
INFO: [Common 17-1381] The checkpoint 'E:/project/FPGA/ai1/05.btn_debounce_2ff/05.btn_debounce_2ff.runs/impl_1/top_btn_routed.dcp' has been generated.
INFO: [runtcl-4] Executing : report_drc -file top_btn_drc_routed.rpt -pb top_btn_drc_routed.pb -rpx top_btn_drc_routed.rpx
Command: report_drc -file top_btn_drc_routed.rpt -pb top_btn_drc_routed.pb -rpx top_btn_drc_routed.rpx
INFO: [IP_Flow 19-1839] IP Catalog is up to date.
INFO: [DRC 23-27] Running DRC with 2 threads
INFO: [Vivado_Tcl 2-168] The results of DRC are in file E:/project/FPGA/ai1/05.btn_debounce_2ff/05.btn_debounce_2ff.runs/impl_1/top_btn_drc_routed.rpt.
report_drc completed successfully
INFO: [runtcl-4] Executing : report_methodology -file top_btn_methodology_drc_routed.rpt -pb top_btn_methodology_drc_routed.pb -rpx top_btn_methodology_drc_routed.rpx
Command: report_methodology -file top_btn_methodology_drc_routed.rpt -pb top_btn_methodology_drc_routed.pb -rpx top_btn_methodology_drc_routed.rpx
INFO: [Timing 38-35] Done setting XDC timing constraints.
INFO: [DRC 23-133] Running Methodology with 2 threads
INFO: [Vivado_Tcl 2-1520] The results of Report Methodology are in file E:/project/FPGA/ai1/05.btn_debounce_2ff/05.btn_debounce_2ff.runs/impl_1/top_btn_methodology_drc_routed.rpt.
report_methodology completed successfully
INFO: [runtcl-4] Executing : report_power -file top_btn_power_routed.rpt -pb top_btn_power_summary_routed.pb -rpx top_btn_power_routed.rpx
Command: report_power -file top_btn_power_routed.rpt -pb top_btn_power_summary_routed.pb -rpx top_btn_power_routed.rpx
INFO: [Timing 38-35] Done setting XDC timing constraints.
Running Vector-less Activity Propagation...

Finished Running Vector-less Activity Propagation
95 Infos, 1 Warnings, 0 Critical Warnings and 0 Errors encountered.
report_power completed successfully
INFO: [runtcl-4] Executing : report_route_status -file top_btn_route_status.rpt -pb top_btn_route_status.pb
INFO: [runtcl-4] Executing : report_timing_summary -max_paths 10 -file top_btn_timing_summary_routed.rpt -pb top_btn_timing_summary_routed.pb -rpx top_btn_timing_summary_routed.rpx -warn_on_violation 
INFO: [Timing 38-91] UpdateTimingParams: Speed grade: -1, Delay Type: min_max.
INFO: [Timing 38-191] Multithreading enabled for timing update using a maximum of 2 CPUs
INFO: [runtcl-4] Executing : report_incremental_reuse -file top_btn_incremental_reuse_routed.rpt
INFO: [Vivado_Tcl 4-1062] Incremental flow is disabled. No incremental reuse Info to report.
INFO: [runtcl-4] Executing : report_clock_utilization -file top_btn_clock_utilization_routed.rpt
INFO: [runtcl-4] Executing : report_bus_skew -warn_on_violation -file top_btn_bus_skew_routed.rpt -pb top_btn_bus_skew_routed.pb -rpx top_btn_bus_skew_routed.rpx
INFO: [Timing 38-91] UpdateTimingParams: Speed grade: -1, Delay Type: min_max.
INFO: [Timing 38-191] Multithreading enabled for timing update using a maximum of 2 CPUs
INFO: [Common 17-206] Exiting Vivado at Thu Feb 12 14:28:06 2026...

*** Running vivado
    with args -log top_btn.vdi -applog -m64 -product Vivado -messageDb vivado.pb -mode batch -source top_btn.tcl -notrace



****** Vivado v2021.1 (64-bit)
  **** SW Build 3247384 on Thu Jun 10 19:36:33 MDT 2021
  **** IP Build 3246043 on Fri Jun 11 00:30:35 MDT 2021
    ** Copyright 1986-2021 Xilinx, Inc. All Rights Reserved.

source top_btn.tcl -notrace
Command: open_checkpoint top_btn_routed.dcp

Time (s): cpu = 00:00:00 ; elapsed = 00:00:00.030 . Memory (MB): peak = 1283.473 ; gain = 0.000
INFO: [Device 21-403] Loading part xc7a35tcpg236-1
Netlist sorting complete. Time (s): cpu = 00:00:00 ; elapsed = 00:00:00.001 . Memory (MB): peak = 1283.473 ; gain = 0.000
INFO: [Netlist 29-17] Analyzing 5 Unisim elements for replacement
INFO: [Netlist 29-28] Unisim Transformation completed in 0 CPU seconds
INFO: [Project 1-479] Netlist was created with Vivado 2021.1
INFO: [Project 1-570] Preparing netlist for logic optimization
INFO: [Timing 38-478] Restoring timing data from binary archive.
INFO: [Timing 38-479] Binary timing data restore complete.
INFO: [Project 1-856] Restoring constraints from binary archive.
INFO: [Project 1-853] Binary constraint restore complete.
Reading XDEF placement.
Reading placer database...
Reading XDEF routing.
Read XDEF File: Time (s): cpu = 00:00:01 ; elapsed = 00:00:00.073 . Memory (MB): peak = 1530.223 ; gain = 6.980
Restored from archive | CPU: 1.000000 secs | Memory: 0.000000 MB |
Finished XDEF File Restore: Time (s): cpu = 00:00:01 ; elapsed = 00:00:00.073 . Memory (MB): peak = 1530.223 ; gain = 6.980
Netlist sorting complete. Time (s): cpu = 00:00:00 ; elapsed = 00:00:00 . Memory (MB): peak = 1530.223 ; gain = 0.000
INFO: [Project 1-111] Unisim Transformation Summary:
No Unisim elements were transformed.

INFO: [Project 1-604] Checkpoint was created with Vivado v2021.1 (64-bit) build 3247384
open_checkpoint: Time (s): cpu = 00:00:12 ; elapsed = 00:00:12 . Memory (MB): peak = 1530.223 ; gain = 246.750
Command: write_bitstream -force top_btn.bit
Attempting to get a license for feature 'Implementation' and/or device 'xc7a35t'
INFO: [Common 17-349] Got license for feature 'Implementation' and/or device 'xc7a35t'
Running DRC as a precondition to command write_bitstream
INFO: [IP_Flow 19-234] Refreshing IP repositories
INFO: [IP_Flow 19-1704] No user IP repositories specified
INFO: [IP_Flow 19-2313] Loaded Vivado IP repository 'E:/Xilinx/Vivado/2021.1/data/ip'.
INFO: [DRC 23-27] Running DRC with 2 threads
WARNING: [DRC PDRC-153] Gated clock check: Net u_button_debounce/u1_D_FF/w_clean_btn is a gated clock net sourced by a combinational pin u_button_debounce/u1_D_FF/r_led_toggle_i_2/O, cell u_button_debounce/u1_D_FF/r_led_toggle_i_2. This is not good design practice and will likely impact performance. For SLICE registers, for example, use the CE pin to control the loading of data.
WARNING: [DRC PLHOLDVIO-2] Non-Optimal connections which could lead to hold violations: A LUT u_button_debounce/u1_D_FF/r_led_toggle_i_2 is driving clock pin of 1 cells. This could lead to large hold time violations. Involved cells are:
u_led_toggle/r_led_toggle_reg
INFO: [Vivado 12-3199] DRC finished with 0 Errors, 2 Warnings
INFO: [Vivado 12-3200] Please refer to the DRC report (report_drc) for more information.
INFO: [Designutils 20-2272] Running write_bitstream with 2 threads.
Loading data files...
Loading site data...
Loading route data...
Processing options...
Creating bitmap...
Creating bitstream...
Bitstream compression saved 15827744 bits.
Writing bitstream ./top_btn.bit...
INFO: [Vivado 12-1842] Bitgen Completed Successfully.
INFO: [#UNDEF] WebTalk data collection is mandatory when using a WebPACK part without a full Vivado license. To see the specific WebTalk data collected for your design, open the usage_statistics_webtalk.html or usage_statistics_webtalk.xml file in the implementation directory.
INFO: [Common 17-83] Releasing license: Implementation
22 Infos, 2 Warnings, 0 Critical Warnings and 0 Errors encountered.
write_bitstream completed successfully
write_bitstream: Time (s): cpu = 00:00:08 ; elapsed = 00:00:09 . Memory (MB): peak = 2010.777 ; gain = 480.555
INFO: [Common 17-206] Exiting Vivado at Thu Feb 12 14:28:49 2026...
